{
  "$schema": "http://json-schema.org/draft-07/schema#",
  "title": "Resume Data Schema",
  "type": "object",
  "properties": {
    "personal": {
      "type": "object",
      "properties": {
        "name": { "type": "string" },
        "title": { "type": "string" },
        "email": { "type": "string", "format": "email" },
        "phone": { "type": "string" },
        "location": { "type": "string" },
        "photo": { "type": "string", "format": "uri" }
      },
      "required": ["name", "title", "email", "phone", "location"]
    },
    "summary": { "type": "string" },
    "experience": {
      "type": "array",
      "items": {
        "type": "object",
        "properties": {
          "title": { "type": "string" },
          "company": { "type": "string" },
          "startDate": { "type": "string" },
          "endDate": { "type": "string" },
          "current": { "type": "boolean" },
          "description": { "type": "string" },
          "achievements": {
            "type": "array",
            "items": { "type": "string" }
          }
        },
        "required": ["title", "company", "startDate", "current", "description"]
      }
    },
    "education": {
      "type": "array",
      "items": {
        "type": "object",
        "properties": {
          "degree": { "type": "string" },
          "school": { "type": "string" },
          "year": { "type": "string" },
          "gpa": { "type": "string" }
        },
        "required": ["degree", "school", "year"]
      }
    },
    "skills": {
      "type": "object",
      "properties": {
        "technical": {
          "type": "array",
          "items": { "type": "string" }
        },
        "soft": {
          "type": "array",
          "items": { "type": "string" }
        },
        "languages": {
          "type": "array",
          "items": { "type": "string" }
        }
      }
    },
    "projects": {
      "type": "array",
      "items": {
        "type": "object",
        "properties": {
          "name": { "type": "string" },
          "description": { "type": "string" },
          "technologies": {
            "type": "array",
            "items": { "type": "string" }
          },
          "link": { "type": "string" }
        },
        "required": ["name", "description"]
      }
    },
    "certifications": {
      "type": "array",
      "items": {
        "type": "object",
        "properties": {
          "name": { "type": "string" },
          "issuer": { "type": "string" },
          "date": { "type": "string" },
          "id": { "type": "string" }
        },
        "required": ["name", "issuer", "date"]
      }
    },
    "awards": {
      "type": "array",
      "items": {
        "type": "object",
        "properties": {
          "name": { "type": "string" },
          "organization": { "type": "string" },
          "year": { "type": "string" },
          "description": { "type": "string" }
        },
        "required": ["name", "organization", "year"]
      }
    }
  },
  "required": ["personal", "summary", "experience", "education", "skills"]
}